{
  "$schema": "https://json-schema.org/draft/2020-12/schema",
  "title": "BossFile",
  "description": "One boss: budget, stages and move table (architecture section 4, content/bosses). Which fields a boss needs depends on its behaviour: caffeine uses stage2Budget to moves, toast uses song and workOrder. Rules the schema cannot state (the fields of each behaviour, telegraph lengths per tier, live windows no longer than the dodge i-frames, the summoned enemy existing) are checked in core/combat/bosses/boss.ts.",
  "type": "object",
  "additionalProperties": false,
  "required": ["version", "id", "behaviour", "budget", "notes"],
  "properties": {
    "version": { "const": 1 },
    "id": { "description": "Matches the boss field of the enemy in content/enemies.json.", "type": "string", "pattern": "^[a-z][a-z0-9_]*$" },
    "behaviour": { "description": "Which core controller runs this boss.", "enum": ["caffeine", "toast"] },
    "song": { "$ref": "#/$defs/BossSong" },
    "workOrder": { "$ref": "#/$defs/BossWorkOrder" },
    "concedeDialogue": { "description": "Toast: the conversation that opens when his budget runs out; it sets whatever lets the chapter go on.", "type": "string", "minLength": 1 },
    "budget": { "description": "Annual budget, the boss's health (design doc 5.8).", "type": "integer", "minimum": 1 },
    "stage2Budget": { "description": "Stage 2 starts once the budget falls to this.", "type": "integer", "minimum": 1 },
    "speedTiles": { "description": "Walking speed in tiles per second before caffeine.", "type": "number", "exclusiveMinimum": 0 },
    "rangeTiles": { "description": "Preferred distance from the operator, [near, far] in tiles.", "type": "array", "minItems": 2, "maxItems": 2, "items": { "type": "number", "minimum": 0 } },
    "restSeconds": { "description": "Pause between moves before caffeine; caffeine shortens it.", "type": "number", "minimum": 0 },
    "drink": { "$ref": "#/$defs/BossDrink" },
    "summon": { "$ref": "#/$defs/BossSummon" },
    "powerCutSeconds": { "description": "How long the stage-3 power cut holds the boss still.", "type": "number", "exclusiveMinimum": 0 },
    "moves": { "type": "object", "additionalProperties": { "$ref": "#/$defs/BossMove" } },
    "notes": { "description": "Provenance of the numbers (DOC, ASSUME), as in content/params.json.", "type": "object", "additionalProperties": { "type": "string" } }
  },
  "$defs": {
    "BossSong": {
      "description": "Toast: the song of 乾杯三巡 (design doc 7.7). Each round sings its lines, one ring of toast waves per line, then breathes; after the last round the last one repeats.",
      "type": "object",
      "additionalProperties": false,
      "required": ["wakeTiles", "introSeconds", "rounds", "breathSeconds", "breathDamageFactor", "ring"],
      "properties": {
        "wakeTiles": { "description": "He waits, silent, until the operator comes this close; the room's intro conversation should fire before that.", "type": "number", "exclusiveMinimum": 0 },
        "introSeconds": { "description": "From waking to the first line.", "type": "number", "minimum": 0 },
        "rounds": { "description": "At most three, one per stage of the nameplate.", "type": "array", "minItems": 1, "maxItems": 3, "items": { "$ref": "#/$defs/BossRound" } },
        "breathSeconds": { "description": "The breath after each round's last line, his weak point.", "type": "number", "exclusiveMinimum": 0 },
        "breathDamageFactor": { "description": "Damage multiplier while he breathes.", "type": "number", "minimum": 1 },
        "ring": { "$ref": "#/$defs/BossRing" }
      }
    },
    "BossRound": {
      "type": "object",
      "additionalProperties": false,
      "required": ["lines", "beatSeconds"],
      "properties": {
        "lines": { "description": "Lines sung this round, one wave each.", "type": "integer", "minimum": 1 },
        "beatSeconds": { "description": "From one wave to the next; longer than the 0.5 s tier-1 telegraph, so each line's warning plays out before the next begins.", "type": "number", "exclusiveMinimum": 0 }
      }
    },
    "BossRing": {
      "type": "object",
      "additionalProperties": false,
      "required": ["shots", "shotSpeedTiles", "rangeTiles", "cups"],
      "properties": {
        "shots": { "description": "Shots evenly round the ring, one aimed at the operator.", "type": "integer", "minimum": 1 },
        "shotSpeedTiles": { "type": "number", "exclusiveMinimum": 0 },
        "rangeTiles": { "type": "number", "exclusiveMinimum": 0 },
        "cups": { "description": "Cups one landed wave adds to the liver's receiving area.", "type": "integer", "minimum": 1 }
      }
    },
    "BossWorkOrder": {
      "description": "Toast: alcohol work orders on the operator from the moment he wakes until he concedes, breaths included, one per cup waiting in receiving.",
      "type": "object",
      "additionalProperties": false,
      "required": ["slowPerStack", "maxStacks"],
      "properties": {
        "slowPerStack": { "type": "number", "exclusiveMinimum": 0, "maximum": 1 },
        "maxStacks": { "type": "integer", "minimum": 1 }
      }
    },
    "BossDrink": {
      "type": "object",
      "additionalProperties": false,
      "required": ["seconds", "refillDelaySeconds", "burstCups", "tolerantFromCup"],
      "properties": {
        "seconds": { "type": "number", "exclusiveMinimum": 0 },
        "refillDelaySeconds": { "description": "Stage 1: how long the residue stays under the boost threshold before the next cup.", "type": "number", "minimum": 0 },
        "burstCups": { "description": "Cups drunk back to back on entering stage 2 and after each power cut.", "type": "integer", "minimum": 1 },
        "tolerantFromCup": { "description": "From this cup on the boost is the tolerant one (design doc 7.4: the third).", "type": "integer", "minimum": 1 }
      }
    },
    "BossSummon": {
      "type": "object",
      "additionalProperties": false,
      "required": ["enemy", "count", "everySeconds", "max", "seconds"],
      "properties": {
        "enemy": { "description": "Enemy id from content/enemies.json.", "type": "string" },
        "count": { "type": "integer", "minimum": 1 },
        "everySeconds": { "type": "number", "exclusiveMinimum": 0 },
        "max": { "description": "Most summoned enemies alive at once.", "type": "integer", "minimum": 1 },
        "seconds": { "description": "Length of the summoning pose.", "type": "number", "exclusiveMinimum": 0 }
      }
    },
    "BossMove": {
      "type": "object",
      "additionalProperties": false,
      "required": ["tier", "weight", "telegraphSeconds", "recoverSeconds", "halves"],
      "properties": {
        "tier": { "description": "Warning tier (design doc 5.3): 1 throws shots, 2 marks an area at the operator, 3 is a proposal around the boss.", "enum": [1, 2, 3] },
        "weight": { "description": "Relative chance of being picked.", "type": "integer", "minimum": 1 },
        "telegraphSeconds": { "type": "number", "exclusiveMinimum": 0 },
        "recoverSeconds": { "type": "number", "minimum": 0 },
        "halves": { "description": "Half hearts per hit.", "type": "integer", "minimum": 1 },
        "shots": { "description": "Tier 1: shots per throw, fanned around the aim.", "type": "integer", "minimum": 1 },
        "spreadDeg": { "description": "Tier 1: degrees between neighbouring shots.", "type": "number", "minimum": 0 },
        "shotSpeedTiles": { "description": "Tier 1: tiles per second.", "type": "number", "exclusiveMinimum": 0 },
        "rangeTiles": { "description": "Tier 1: how far a shot flies.", "type": "number", "exclusiveMinimum": 0 },
        "radiusTiles": { "description": "Tier 2 and 3: radius of the area.", "type": "number", "exclusiveMinimum": 0 },
        "activeTicks": { "description": "Tier 2 and 3: ticks the area stays live after the telegraph.", "type": "integer", "minimum": 1 }
      }
    }
  }
}
